<?xml version="1.0" encoding="UTF-8"?>
<?xml-stylesheet href="payment.xsl" type="text/xsl" ?>
<payment:transactions xmlns:xsi="http://www.w3.org/2001/XMLSchema-instance" xmlns:payment="http://www.example.com/payment" xsi:schemaLocation="http://www.example.com/payment payment.xsd">
    <payment:transaction id="t1">
        <payment:username>AaravSharma01</payment:username>
        <payment:amount>1200.50</payment:amount>
        <payment:currency>INR</payment:currency>
        <payment:date>2024-08-11</payment:date>
        <payment:status>Completed</payment:status>
        <payment:cardNumber>4111111111111111</payment:cardNumber>
        <payment:expiryDate>2026-05</payment:expiryDate>
    </payment:transaction>
    <payment:transaction id="t2">
        <payment:username>IshaPatel89</payment:username>
        <payment:amount>750.00</payment:amount>
        <payment:currency>INR</payment:currency>
        <payment:date>2024-08-10</payment:date>
        <payment:status>Pending</payment:status>
        <payment:cardNumber>5555555555554444</payment:cardNumber>
        <payment:expiryDate>2025-07</payment:expiryDate>
    </payment:transaction>
    <payment:transaction id="t3">
        <payment:username>RohitVerma77</payment:username>
        <payment:amount>3500.25</payment:amount>
        <payment:currency>INR</payment:currency>
        <payment:date>2024-08-09</payment:date>
        <payment:status>Completed</payment:status>
        <payment:cardNumber>6011000990139424</payment:cardNumber>
        <payment:expiryDate>2024-09</payment:expiryDate>
    </payment:transaction>
    <payment:transaction id="t4">
        <payment:username>AnikaMehta55</payment:username>
        <payment:amount>2499.99</payment:amount>
        <payment:currency>INR</payment:currency>
        <payment:date>2024-08-08</payment:date>
        <payment:status>Failed</payment:status>
        <payment:cardNumber>3566002020360505</payment:cardNumber>
        <payment:expiryDate>2023-12</payment:expiryDate>
    </payment:transaction>
    <payment:transaction id="t5">
        <payment:username>KabirSingh23</payment:username>
        <payment:amount>500.00</payment:amount>
        <payment:currency>INR</payment:currency>
        <payment:date>2024-08-07</payment:date>
        <payment:status>Completed</payment:status>
        <payment:cardNumber>4532756279624064</payment:cardNumber>
        <payment:expiryDate>2025-04</payment:expiryDate>
    </payment:transaction>
    <payment:transaction id="t6">
        <payment:username>PriyaGupta88</payment:username>
        <payment:amount>1850.75</payment:amount>
        <payment:currency>INR</payment:currency>
        <payment:date>2024-08-06</payment:date>
        <payment:status>Pending</payment:status>
        <payment:cardNumber>374111111111111</payment:cardNumber>
        <payment:expiryDate>2024-10</payment:expiryDate>
    </payment:transaction>
    <payment:transaction id="t7">
        <payment:username>VikramRao67</payment:username>
        <payment:amount>2999.99</payment:amount>
        <payment:currency>INR</payment:currency>
        <payment:date>2024-08-05</payment:date>
        <payment:status>Completed</payment:status>
        <payment:cardNumber>301111111111111</payment:cardNumber>
        <payment:expiryDate>2026-02</payment:expiryDate>
    </payment:transaction>
    <payment:transaction id="t8">
        <payment:username>NishaKumar99</payment:username>
        <payment:amount>999.50</payment:amount>
        <payment:currency>INR</payment:currency>
        <payment:date>2024-08-04</payment:date>
        <payment:status>Failed</payment:status>
        <payment:cardNumber>6011000990139424</payment:cardNumber>
        <payment:expiryDate>2025-11</payment:expiryDate>
    </payment:transaction>
</payment:transactions>
